product,answer_option,review_score
Shelcal,The manufacturing date is months old You should provide fresh strip of shell with recent manufacturing date!,0.6344647519582245
Shelcal,satisfactory as usual shell 500 is prescribed by my Doctor is also recorded with you through my prescription.,0.6292428198433421
Shelcal,Useful for bones,0.6292428198433421
Shelcal,its good,0.6292428198433421
Shelcal,Same brand,0.6240208877284595
Shelcal,Nothing Specific,0.6240208877284595
Shelcal,Ease of finding,0.618798955613577
Shelcal,Ok good,0.6161879895561357
Shelcal,Liked,0.6135770234986945
Shelcal,Speed and ease and discount,0.6135770234986945
Shelcal,Discount was less than available in the market,0.608355091383812
Shelcal,Great tablets for bone problems,0.6031331592689295
Shelcal,Nice packing and good tablet for my health,0.6031331592689295
Shelcal,I liked it,0.597911227154047
Shelcal,Its working very good,0.5926892950391645
Shelcal,It is run of a mill product. Nothing special,0.5926892950391645
Shelcal,Good for health,0.587467362924282
Shelcal,U say 20% discount but not applied on this,0.5796344647519582
Shelcal,Delivery as usual,0.577023498694517
Shelcal,Satisfactory,0.5744125326370757
Shelcal,Good tablet,0.5639686684073107
Shelcal,I dislike die to less discount,0.5587467362924282
Shelcal,Getting relief in toe pain,0.556135770234987
Shelcal,Good response,0.556135770234987
Shelcal,Good calcium supplement Recommended by most doctors,0.5509138381201044
Shelcal,Thanks,0.5509138381201044
Shelcal,It is really excellent Everyone can use it.,0.5456919060052219
Shelcal,its good to have maintain calcium deficiency,0.5456919060052219
Shelcal,excellent service,0.5456919060052219
Shelcal,Everything,0.5430809399477807
Shelcal,The medicine is fine but the my other medicine is canceled by the vendor,0.5404699738903395
Shelcal,You have sent wrong qty and missed one item which I never expected even after sending typed list in English,0.5378590078328982
Shelcal,Proper packing,0.5352480417754569
Shelcal,"i like it,shelcal-500 is very good to improve bone structure,it helps me to my fracture last year,",0.5195822454308094
Shelcal,Usual genuine medicine,0.5169712793733682
Shelcal,Thecal is good calcium tablets take it daily regularly,0.48825065274151436
Shelcal,Calcium supplement are most post menopausal,0.4804177545691906
Shelcal,Since I am diabetic my doctor advise me take 1 tab once a day..,0.412532637075718
Shelcal,Ease of finding,0.412532637075718
Shelcal,known medicine for calcium,0.4046997389033943
Shelcal,Quite effective than other calcium supplement,0.39947780678851175
Shelcal,Thecal is good calcium tablets take it daily regularly,0.39947780678851175
Shelcal,"its effectable,after 40 every women should be use",0.39947780678851175
Shelcal,nothing to dislike,0.39947780678851175
Shelcal,Very much liked,0.39947780678851175
Shelcal,So many simple vitamin tablets were not sent because of prescription,0.39947780678851175
Shelcal,Have to take them whether like or not,0.39947780678851175
Shelcal,The new print on the backside,0.3968668407310705
Shelcal,Ease of ordering fast delivery and no confusion,0.3968668407310705
Shelcal,Came on time without any damage,0.3968668407310705
Shelcal,This order was delivered timely as compared to other order which took more than 10 days to deliver,0.3968668407310705
Shelcal,Good Packing & Useful Tablet,0.3968668407310705
Shelcal,I like the home delivery service is very good,0.3968668407310705
Shelcal,They are good for older persons,0.39425587467362927
Shelcal,Send all items together,0.39425587467362927
Shelcal,Good one my daughter,0.39425587467362927
Shelcal,Satisfactory Service besides some minor negligencies.,0.391644908616188
Shelcal,No commitment and no fixed delivery schedule,0.391644908616188
Shelcal,Delivery group was there However product n packing were good,0.391644908616188
Shelcal,Sweet outer coating is easy to swallow,0.38903394255874674
Shelcal,Thecal is a good calcium supplement from a reputed company at a reasonable price.,0.38903394255874674
Shelcal,calcium supplement recommended by Mrs,0.38903394255874674
Shelcal,IT IS HELPFUL TO MY BODY,0.38903394255874674
Shelcal,Very effective tablet for artho problem,0.38903394255874674
Shelcal,It is run of a mill product. Nothing special,0.38903394255874674
Shelcal,Discount is very minimal,0.38642297650130547
Shelcal,Discount compare to others,0.38642297650130547
Shelcal,Discount is not given according to mentioned,0.38642297650130547
Shelcal,Very Poor Service,0.38642297650130547
Shelcal,Excellent response and fabulous discount,0.38642297650130547
Shelcal,My doctor recommends this during the pregnancy and post pregnancy,0.381201044386423
Shelcal,i had cracking sound from knees which persists even now after having shell for a month,0.34986945169712796
Shelcal,good product and quick delivery,0.3472584856396867
Shelcal,delivered on time.with discount,0.31070496083550914
Shelcal,its a good calcium supplement....,0.3028720626631854
Shelcal,Good calcium tablets No side effects,0.3028720626631854
Shelcal,Like to buy,0.3028720626631854
Shelcal,want say until use by minimum month,0.3028720626631854
Shelcal,I didn order for shell 500 tablet.,0.3028720626631854
Shelcal,"Its not use me, I enquire for my friend",0.3028720626631854
Shelcal,Good,0.3028720626631854
Shelcal,Yes,0.3028720626631854
Shelcal,Very poor service and not print got my medicine after days ..lots of improvement required,0.3028720626631854
Shelcal,No question of like or dislike! Doctor prescribed,0.3002610966057441
Shelcal,The medicine is fine but the my other medicine is canceled by the vendor,0.3002610966057441
Shelcal,Discount is not applicable on this product.,0.3002610966057441
Shelcal,This order was delivered timely as compared to other order which took more than 10 days to deliver,0.3002610966057441
Shelcal,I am taking it in good faith expecting it to be genuine No question to like or dislike it.,0.3002610966057441
Shelcal,Very late delivery,0.3002610966057441
Shelcal,Order canceled,0.3002610966057441
Shelcal,Timely delivery with less price,0.3002610966057441
Shelcal,fast service,0.3002610966057441
Shelcal,I feel its effective,0.2950391644908616
Shelcal,My father and wife have been having this calcium supplement for many years,0.2950391644908616
Shelcal,as per the order,0.2950391644908616
Shelcal,Good,0.2950391644908616
Shelcal,Very satisfied,0.2950391644908616
Shelcal,Best purchase,0.2950391644908616
Shelcal,normal rate,0.2950391644908616
Shelcal,normal,0.2950391644908616
Shelcal,Just started taking this tablet 1 month back canst say anything right now,0.2924281984334204
Shelcal,Rate of discount offered is very less compared to what others are offering,0.2924281984334204
Shelcal,Protected packing and effective for bone density,0.2924281984334204
Shelcal,this again is a calcium supplement recommended for my wife She is happy with the tablet.,0.2819843342036554
Shelcal,shell is always good choice,0.2819843342036554
Shelcal,Good for daily nutrient,0.2819843342036554
Shelcal,Result is good,0.2819843342036554
Shelcal,The medicines are original People can rely on you,0.2819843342036554
Shelcal,Calcium boasting,0.2819843342036554
Shelcal,Delivery very late,0.2793733681462141
Shelcal,I like it,0.27154046997389036
Shelcal,Optical priced. good supplement,0.26109660574412535
Shelcal,Discount was less than available in the market,0.2584856396866841
Shelcal,Less Discount,0.2584856396866841
Shelcal,Bought as advised by the doctor,0.25326370757180156
Shelcal,Good calcium substitute,0.2402088772845953
Shelcal,Not much effective,0.23237597911227154
Shelcal,its a gold standard,0.23237597911227154
Shelcal,Display rate was higher than MRP..,0.23237597911227154
Shelcal,Good response,0.23237597911227154
Shelcal,Delivery,0.2297650130548303
Shelcal,"Dislike price, like packing",0.20887728459530025
Shelcal,Good tablets,0.18276762402088773
Shelcal,We needed more discount,0.18276762402088773
Shelcal,Good source of Calcium and Vitamin D3,0.17754569190600522
Shelcal,Discount is very less,0.17754569190600522
Shelcal,Rated good to treat calcium and vitamin deficiency,0.1462140992167102
Shelcal,Problem regarding the delivery,0.14360313315926893
Shelcal,Best for calcium intake,0.12010443864229765
Shelcal,Best for calcium intake,0.12010443864229765
Shelcal,Feeling comfortable in joints,0.12010443864229765
Shelcal,Calcium supplement are most post menopausal,0.12010443864229765
Shelcal,Good as calcium supplement,0.12010443864229765
Shelcal,Nothing to say.,0.12010443864229765
Shelcal,Star product of company,0.12010443864229765
Shelcal,It is ok,0.12010443864229765
Shelcal,Same as my previous reply,0.12010443864229765
Shelcal,Everything,0.12010443864229765
Shelcal,THE EXPIRY DATE WAS NOT CHECKED BEFORE PACKING,0.12010443864229765
Shelcal,Item is good and packed very well,0.12010443864229765
Shelcal,Item is good and packed very well,0.12010443864229765
Shelcal,Why dont you use local shops as delivery partner. its preposterous that in today day and age we need to wait ONE FREAKING WEEK FOR DELIVERY,0.1174934725848564
Shelcal,Quick delivery of medicine is very much appreciated,0.1174934725848564
Shelcal,I purchased it was 15 tablet strip not up to the mark seems duplicate not controlling sugar legal,0.10966057441253264
Shelcal,Satisfactory Service besides some minor negligencies.,0.10966057441253264
Shelcal,Discount Is Good,0.10443864229765012
Shelcal,indians best calcium with vitamin D tab,0.10182767624020887
Shelcal,Advised by doctors to make up calcium intake for strong bones specially for elderly,0.10182767624020887
Shelcal,Helps fr old age patients,0.10182767624020887
Shelcal,its a prescribed medicine to my mom.,0.10182767624020887
Shelcal,Shel Al is a standard calcium tablet,0.10182767624020887
Shelcal,My father and wife have been having this calcium supplement for many years,0.10182767624020887
Shelcal,"The whole action from your end,",0.10182767624020887
Shelcal,It is effective medicine,0.10182767624020887
Shelcal,The ambiance of the strip was good not old or tampered,0.10182767624020887
Shelcal,Recommended by Doctor at Sunshine Hospital.,0.10182767624020887
Shelcal,Good tablets,0.10182767624020887
Shelcal,Excellent,0.10182767624020887
Shelcal,Very useful,0.10182767624020887
Shelcal,Calcium supplement,0.10182767624020887
Shelcal,Discount n ease of shopping online,0.10182767624020887
Shelcal,Came on time without any damage,0.10182767624020887
Shelcal,Problem regarding the delivery,0.10182767624020887
Shelcal,Very delayed delivery and if we wish to cancel they are not refunding the money instead adding it to their wallet which is not at all useful,0.10182767624020887
Shelcal,liked packing and delivery,0.10182767624020887
Shelcal,Nice packing and good tablet for my health,0.10182767624020887
Shelcal,Delivery date was too late,0.09921671018276762
Shelcal,Packing quality,0.09921671018276762
Shelcal,Mental feeling as if it is working,0.09660574412532637
Shelcal,Good product....,0.08877284595300261
Shelcal,Didn't dislike anything,0.08616187989556136
Shelcal,good service,0.0835509138381201
Shelcal,5 Genuine,0.0835509138381201
Shelcal,Good source of Calcium and Vitamin D3,0.06266318537859007
Shelcal,Nothing,0.06266318537859007
Shelcal,Very fast delivery,0.06266318537859007
Shelcal,very useful product,0.0
Shelcal,calcium supplement recommended by Mrs,0.0
Shelcal,good product,0.0
Shelcal,I like very much,0.0
Shelcal,its good,0.0
Shelcal,Efficient responsiveness,0.0
Shelcal,Delivery is slow,0.0
SevenseascodLiverOil,excellent for vitamin deficiency good jelly capsules,0.9876543209876543
SevenseascodLiverOil,its good for hair fall,0.9876543209876543
SevenseascodLiverOil,Not the missing ingredient in my body Feeling better after taking it,0.9629629629629629
SevenseascodLiverOil,It was a good for kids immunity,0.9506172839506173
SevenseascodLiverOil,Not satisfied because goods are delivered on parts .,0.9506172839506173
SevenseascodLiverOil,"I like product. But, dont like delivery",0.9259259259259259
SevenseascodLiverOil,Prompt delivery at reduced cost,0.9012345679012346
SevenseascodLiverOil,Best quality products,0.8518518518518519
SevenseascodLiverOil,Delivery was bit delayed delivery was made through different courier and timely update was not available,0.8395061728395061
SevenseascodLiverOil,The condition in which it was delivered was worst,0.8395061728395061
SevenseascodLiverOil,Trusted remedy for health. Used for many years,0.8271604938271605
SevenseascodLiverOil,It is a good supplement,0.8148148148148148
SevenseascodLiverOil,easy and best deal,0.8148148148148148
SevenseascodLiverOil,Nice bottling.. Not sure whether it would help or not...,0.8148148148148148
SevenseascodLiverOil,Timely delivery and discount,0.8148148148148148
SevenseascodLiverOil,good package decent price,0.8148148148148148
SevenseascodLiverOil,Exciting discount prompt delivery,0.7901234567901234
SevenseascodLiverOil,Good packing and product was delivered before time.I liked the service a lot.,0.7901234567901234
SevenseascodLiverOil,its best for improvement of immune system,0.7777777777777778
SevenseascodLiverOil,Excellent response Perfect delivery,0.7530864197530864
SevenseascodLiverOil,Have used it earlier but results are very late may be its purity not same as earlier,0.7407407407407407
SevenseascodLiverOil,Good in nutrition content and good for health,0.7283950617283951
SevenseascodLiverOil,I have already used it before,0.6666666666666666
SevenseascodLiverOil,Dismounted price Fresh product,0.6666666666666666
SevenseascodLiverOil,Price n packing (Big package more savings,0.6419753086419753
SevenseascodLiverOil,Good for eye and memory as vitamin,0.6296296296296297
SevenseascodLiverOil,Better than any other product claiming to improve immunity,0.6296296296296297
SevenseascodLiverOil,The product was good with long expire,0.6296296296296297
SevenseascodLiverOil,It is original,0.6172839506172839
SevenseascodLiverOil,Glucosamine Tablets are canceled,0.6172839506172839
SevenseascodLiverOil,Original item. Sold without any discount at MRP,0.6172839506172839
SevenseascodLiverOil,5 liked the product very much,0.6049382716049383
SevenseascodLiverOil,4. Promptness and price,0.6049382716049383
SevenseascodLiverOil,QUALITY IS GOOD AND PRIZE IS LOW,0.5925925925925926
SevenseascodLiverOil,Not feeling Any difference,0.5925925925925926
SevenseascodLiverOil,Discount & fast delivery,0.5925925925925926
SevenseascodLiverOil,Packaging of the product and timely delivery,0.5802469135802469
SevenseascodLiverOil,it should come back in glass jar....,0.5432098765432098
SevenseascodLiverOil,Quality is good Packing forwarding OK,0.49382716049382713
SevenseascodLiverOil,its a trusted products from my childhood days,0.48148148148148145
SevenseascodLiverOil,No major change after taking these tablets,0.48148148148148145
SevenseascodLiverOil,packing delivery was all smooth & convenient,0.4691358024691358
SevenseascodLiverOil,The packing is same for years I could relate to product from the memory down the years,0.4567901234567901
SevenseascodLiverOil,Good one seen improvements,0.4444444444444444
SevenseascodLiverOil,Seams original cod liver oil,0.4444444444444444
SevenseascodLiverOil,Like but less discount,0.4444444444444444
SevenseascodLiverOil,Good & effective product for the given low price.,0.43209876543209874
SevenseascodLiverOil,You are gang of thief,0.43209876543209874
SevenseascodLiverOil,"This cod lever capsules should be kept in below 10°C, you should see that it should be kept in a ice box during delivery",0.43209876543209874
SevenseascodLiverOil,Caused problems for health,0.41975308641975306
SevenseascodLiverOil,Package quantity is not good,0.41975308641975306
SevenseascodLiverOil,Bottle packing quality very bad,0.41975308641975306
SevenseascodLiverOil,Delievery and Product quality,0.4074074074074074
SevenseascodLiverOil,Difficult to open bottle lid as its not proper Not sure if this one is a duplicate product too.,0.3950617283950617
SevenseascodLiverOil,Product and timely delivery,0.3950617283950617
SevenseascodLiverOil,"Good product, secure packaging, value for money",0.345679012345679
SevenseascodLiverOil,i like it and its good in results,0.08641975308641975
SevenseascodLiverOil,its good for health.,0.08641975308641975
SevenseascodLiverOil,I have ordered senses but i feel like that the product is not in original,0.08641975308641975
SevenseascodLiverOil,I am not a doctor,0.08641975308641975
SevenseascodLiverOil,Bottle cap is free,0.08641975308641975
SevenseascodLiverOil,Colour like a gold due,0.08641975308641975
SevenseascodLiverOil,"Dislike , original monogram (logo) not match original product.",0.08641975308641975
SevenseascodLiverOil,But I got this product very late ...,0.08641975308641975
SevenseascodLiverOil,It was packed very carefully and delivered with in time,0.08641975308641975
SevenseascodLiverOil,Delivery time is much,0.08641975308641975
SevenseascodLiverOil,Ordered 500 Cabs and Not the Delivery for 100 Cabs,0.08641975308641975
SevenseascodLiverOil,Genuine quality at very best price,0.08641975308641975
SevenseascodLiverOil,its really helpful and safe.,0.06172839506172839
SevenseascodLiverOil,Good for immunity system .Every body should take it. No foundation for Male/Female anybody can take it.,0.06172839506172839
SevenseascodLiverOil,At least online available,0.06172839506172839
SevenseascodLiverOil,Packing... Delivery... Discount,0.06172839506172839
SevenseascodLiverOil,its only 15 days but I do feel energetic and good.. so its a thumbs up for me..,0.04938271604938271
SevenseascodLiverOil,its too early,0.04938271604938271
SevenseascodLiverOil,Delivery time is late,0.04938271604938271
SevenseascodLiverOil,AGAIN results are good,0.037037037037037035
SevenseascodLiverOil,Very much like.. Recommended for enhancing immunity of everyone...Must buy again,0.024691358024691357
SevenseascodLiverOil,Good source of omega 3 fatty acid,0.0
SevenseascodLiverOil,Meg 3 is best in winter,0.0
SevenseascodLiverOil,I liked the product,0.0
SevenseascodLiverOil,All is ok but I couldn get discount on seven seas cod lever oil cc capsules,0.0
Neurobion,The rate is very reasonable,0.9831730769230769
Neurobion,All good,0.9831730769230769
Neurobion,Excellent,0.9735576923076923
Neurobion,Along with this i had initially ordered glycogen for which a prescription was called for But what i had unloaded was not a'exited as it was issued in 2015. Since this is regular medication for diabetic control age of the prescription should not matter.,0.9615384615384616
Neurobion,"After having it, I felt itching allergy, acne & pimples problems overall skin problem.",0.7403846153846154
Neurobion,overall good experience and this is one of the best medicine for me and works well over me. thanks,0.7379807692307693
Neurobion,It is as per recommendation.,0.7115384615384616
Neurobion,smells a lot but packed well....,0.7115384615384616
Neurobion,It is good for nerves,0.7019230769230769
Neurobion,I ordered for my mother,0.6826923076923077
Neurobion,Very effective,0.6826923076923077
Neurobion,Great services,0.6826923076923077
Neurobion,Genuine and good pricing,0.6802884615384616
Neurobion,delivery is not unto mark,0.6754807692307693
Neurobion,The packing,0.6754807692307693
Neurobion,Good medicine for vitamin B,0.6730769230769231
Neurobion,Very good for nurbous system,0.6730769230769231
Neurobion,The tablet is very harmful,0.6730769230769231
Neurobion,Best in help of Complex bone and mussel problem,0.6730769230769231
Neurobion,"Cannot remember rhis medicine, rated arbitrarily",0.6730769230769231
Neurobion,Package well,0.6730769230769231
Neurobion,Mud source of b12,0.6706730769230769
Neurobion,Good product,0.6706730769230769
Neurobion,Unfordable product,0.6706730769230769
Neurobion,Excellent service,0.6706730769230769
Neurobion,Delivery should be speed,0.6706730769230769
Neurobion,One of the better vitamin complex tablet with B-12.Very effective,0.6682692307692307
Neurobion,Nothing is mention,0.6658653846153846
Neurobion,Excellent in nerves problems,0.6658653846153846
Neurobion,Good price and quick delivery,0.6658653846153846
Neurobion,Nice Supplement .,0.6634615384615384
Neurobion,Results awaited,0.6634615384615384
Neurobion,No problem at all Everything was excellent,0.65625
Neurobion,Good effect with no side effects,0.6538461538461539
Neurobion,Not as per request,0.6538461538461539
Neurobion,"Using the product, but still I could find the fruitful results",0.6538461538461539
Neurobion,Good product,0.6538461538461539
Neurobion,Nice effects,0.6538461538461539
Neurobion,Nice results,0.6538461538461539
Neurobion,Very good for nerves strength,0.6514423076923077
Neurobion,Good medicine for vitamin B,0.6514423076923077
Neurobion,better composition in this price,0.6514423076923077
Neurobion,Good medicine to use when you have sudden current type feelings,0.6514423076923077
Neurobion,Good one,0.6514423076923077
Neurobion,It is good for Nevas in body,0.6490384615384616
Neurobion,Good supplement,0.6490384615384616
Neurobion,Delivery,0.6490384615384616
Neurobion,It gives strength to veins,0.6466346153846154
Neurobion,Bifurcation of order given,0.6466346153846154
Neurobion,Its a wonderful tablet.,0.6466346153846154
Neurobion,OK. Nice,0.6418269230769231
Neurobion,It was delivered intima,0.6418269230769231
Neurobion,excellent vitamin tablet at lowest pric!e. Value for money !,0.6298076923076923
Neurobion,helpful in gaining strength,0.6225961538461539
Neurobion,I am a diabetic patient and I am taking regularly,0.6201923076923077
Neurobion,Two tablets were exposed as their seals were punctured,0.6201923076923077
Neurobion,I have been prescribed by my doctor for general weakness I feel better,0.6177884615384616
Neurobion,Nice every thing,0.6177884615384616
Neurobion,You failed to deliver medicine twice and without any talk with me you have canceled my two orders,0.6177884615384616
Neurobion,Timely delivery Good packing,0.6177884615384616
Neurobion,I did not purchase it this time.,0.6177884615384616
Neurobion,Fast delivery Authentic product.,0.6177884615384616
Neurobion,I regularly use it for improvement of vitamin B,0.5985576923076923
Neurobion,Good Complex tablet with b12,0.5985576923076923
Neurobion,its a good and cheap combo of neurovitamins,0.5985576923076923
Neurobion,They are useful,0.5985576923076923
Neurobion,All ok,0.5985576923076923
Neurobion,I dont know it work or what .,0.5961538461538461
Neurobion,Everything was prefect,0.5961538461538461
Neurobion,Actually I bought this medicine for my father so I canst tell about this,0.5961538461538461
Neurobion,its a good product.,0.5961538461538461
Neurobion,overall good with price,0.5961538461538461
Neurobion,its good,0.5961538461538461
Neurobion,Prompt,0.5961538461538461
Neurobion,Stop Asking silly questions wasting time,0.5961538461538461
Neurobion,Packing should have been a bit strong,0.5961538461538461
Neurobion,Good packing and expire date,0.5961538461538461
Neurobion,Medicine is good and gives me positive results,0.5913461538461539
Neurobion,"Reasonable price,recommended by doctors no adverse effect noticed it helps nerve strengthening,long term use",0.5913461538461539
Neurobion,its effective against pain due to nerve pitching,0.5913461538461539
Neurobion,best in its class,0.5913461538461539
Neurobion,I have been using it for a while and found it to be a good nerve support,0.5889423076923077
Neurobion,It keeps an old women of 94yrs going,0.5865384615384616
Neurobion,Disprin require percription . Very strange,0.5865384615384616
Neurobion,Till now I didn dislike anything,0.5841346153846154
Neurobion,Like,0.5817307692307693
Neurobion,Increases the nerves strength,0.5793269230769231
Neurobion,overall good experience and this is one of the best medicine for me and works well over me. thanks,0.5793269230769231
Neurobion,Good bit tabs,0.5769230769230769
Neurobion,its good,0.5769230769230769
Neurobion,Slow result. Take it for long time,0.5769230769230769
Neurobion,Medicine not available in stock in required quantity,0.5745192307692307
Neurobion,Best price good results...,0.5745192307692307
Neurobion,The product meets our requirements,0.5721153846153846
Neurobion,Good service,0.5697115384615384
Neurobion,I like neurobiology forte tablet and I take this daily since long time,0.5673076923076923
Neurobion,It is Ok,0.5625
Neurobion,No dislikes,0.5625
Neurobion,No discount I got I got Usually 15 % from my chemist,0.5625
Neurobion,I got all tablets except this one The service was good for all other tablets Since this tablet was not that costly I just left it without complaining,0.5625
Neurobion,good packing but a bit slower delivery considering it was really near my address,0.5625
Neurobion,Best complex at compatible price..,0.5576923076923077
Neurobion,Effective for my mother,0.5576923076923077
Neurobion,The delivery boy said the phone number was not available to call. Packing has to be done appropriately He threatened not to deliver next time if it happens,0.5552884615384616
Neurobion,packing and quality,0.5552884615384616
Neurobion,Not delivered,0.5552884615384616
Neurobion,Very fine working in my bowl.Just I am eating more.digestion is good and i have some brisk.i happy to continue some months.Cost is very cheap.Lot of Thanks to Merkpharma and their mankind of services,0.5552884615384616
Neurobion,AS a Vitamin supplement Neurobion Forte is very good for diabetic,0.5504807692307693
Neurobion,Vitamin supplement at unfordable price.,0.5480769230769231
Neurobion,The rate is very reasonable,0.5480769230769231
Neurobion,Good vitamin,0.5480769230769231
Neurobion,Prompt same day delivery,0.5480769230769231
Neurobion,It is a time tested drug,0.5456730769230769
Neurobion,Because I have not satisfied,0.5432692307692307
Neurobion,The delivery boy said the phone number was not available to call. Packing has to be done appropriately He threatened not to deliver next time if it happens,0.5408653846153846
