product,answer_option,review_score
shampoo,No solution my hair iam sorry no less of dandruff,0.9904761904761905
shampoo,Best in hair scalp problem just wash,0.9714285714285714
shampoo,We are using regularly,0.9333333333333333
shampoo,The delivery person was lazy,0.9333333333333333
shampoo,My hair getting dry after using it . It has side effects and can whitish your hair. Consult doctor for recommendation.,0.9142857142857143
shampoo,Not so effective,0.9142857142857143
shampoo,Before sending to customer PL.go thou order.carefully see the quantity ordered n quantity send To avoid interaction with executive,0.9047619047619048
shampoo,Almost half a bottle is needed for one day use. donot foam..,0.8952380952380953
shampoo,It is better but not a permanent solution for dandruff,0.8952380952380953
shampoo,It does what it says,0.8952380952380953
shampoo,i wanted a good antidandruff hair treatment as my scalp was getting dry very often and troubled by itching scalp at times but no flakes initialy was found good result but later the same,0.8952380952380953
shampoo,I used it many times but dandruff not cured permanently Although it relief but not a permanent solution for me.,0.8952380952380953
shampoo,Price is so high reduce price,0.8761904761904762
shampoo,Is it not an immediate solution for dandraft. We may need to use it for longer time. We need a quick and effective remedy,0.8761904761904762
shampoo,There is no difference in the dandruff after using this shampoo,0.8666666666666667
shampoo,This shampoo prescribed by doctor for my son to avoid dandruff and it works perfectly,0.8571428571428571
shampoo,"its a good conditioned but not effective on dandruff, my scaling is gone..good",0.8571428571428571
shampoo,Good.. Plz launch in different flavors,0.8571428571428571
shampoo,Super sampoo for those person who has rainfall problem,0.8571428571428571
shampoo,Shampoo is good for reducing dandruf,0.8476190476190476
shampoo,Not working as asspacted,0.8476190476190476
shampoo,Reduce dandruff in few days,0.8476190476190476
shampoo,Nice product and I got a very good result from the product.,0.8476190476190476
shampoo,it is a best recommended anti dandruff shampoo I have used ever yes it is a bit costly but the results are good,0.8380952380952381
shampoo,Good working for dandruff and icthing...all problems are solved,0.8285714285714286
shampoo,Product is good but expensive,0.8285714285714286
shampoo,It is very useful for who are effecting by dandruff,0.8285714285714286
shampoo,It is really effective,0.8285714285714286
shampoo,Always check my hair now see my hair no dandruff so happy,0.819047619047619
shampoo,Quite effective and also doesn dry the hair on usage,0.8095238095238095
shampoo,It dose not effect on scalp,0.8095238095238095
shampoo,It is effective but costly,0.8095238095238095
shampoo,I m using 4 time,0.8095238095238095
shampoo,its a great shampoo for dandruff,0.8
shampoo,Not improvement in my hair,0.7904761904761904
shampoo,Need to repeatedly keep using it,0.7904761904761904
shampoo,Scalpe shampoo is effective on the DANDRUFF the basic necessity for which it is recommended The part which hurts is the Cost of the product which is too steep and there is no alternative hence it becomes a necessity,0.780952380952381
shampoo,Good for seborrheic dermatitis,0.780952380952381
shampoo,I like it.use of it to reduce dandruff.,0.7619047619047619
shampoo,Solve my problem in one wash,0.7619047619047619
shampoo,The bottle content is very less thoughts like already used,0.7523809523809524
shampoo,Scalpe anti dandruff shampoo is clinically advised for dandruff and it really works than any other shampoo in market,0.7428571428571429
shampoo,The shampoo is working and the quantity of dandruff has reduced I am looking forward for complete protection and excited,0.7238095238095238
shampoo,good product but it remove dandruff if you use this for long time,0.6952380952380952
shampoo,Good for dandruff control,0.6761904761904762
shampoo,shampoo seems fine..its same as i use to purchase from the local medical shop,0.6761904761904762
shampoo,"I was diagnosed with Seborrheic Dermatitis a decade ago and had been recommended this shampoo for control and management of the condition. A decade later I started experiencing pimples on my forehead from dandruff fall-out and turned to this shampoo again I saw a decrease in pimples in just 3 washes. Would definitely recommend for short-term use, as the shampoo is high on chemicals Would suggets the use of a conditioned post wash as the shampoo is extremely drying",0.6666666666666666
shampoo,Its good but it makes scalpe dry,0.6476190476190476
shampoo,Liked it very nicely working now my scalp is anti dandruff..,0.6285714285714286
shampoo,Works well with my hair oil to decrease dandruff,0.6095238095238096
shampoo,Please verify that vendor right product pack or not,0.6
shampoo,Not work as it explained about that .,0.5619047619047619
shampoo,its my regular choice,0.5523809523809524
shampoo,"Best therapy of dandruff, I like it.",0.5523809523809524
shampoo,No use... Wash ur hair with water.. that much better,0.5428571428571428
shampoo,This Shampoo is good quality n anti dandruff shampoo its working up to 80 percent,0.5333333333333333
shampoo,It really does help but the bottle is only apt for three washes.,0.5333333333333333
shampoo,Really like this shampoo..this does perfectly what it demand to do..,0.5333333333333333
shampoo,Good but not very effective,0.5333333333333333
shampoo,Quality and Right product was made available and within stipulated period of time.,0.5333333333333333
shampoo,Excellent service.. delivery time can be improved,0.5333333333333333
shampoo,Excellent outstanding product,0.5238095238095238
shampoo,Not to much effective,0.5238095238095238
shampoo,want say anything now,0.5238095238095238
shampoo,Good Anti dandruff,0.5238095238095238
shampoo,When I’m using in the beginning I get more hair fall bad after few days my problem was solved,0.5047619047619047
shampoo,Its not much effective as it has been stated in product description.,0.5047619047619047
shampoo,Not worth to buy online if your order value is less Chant ₹500 because of the logistics charges Also courier partner dont accept card only cash So there is scope of improvement in supply chain and payment,0.5047619047619047
shampoo,"Excellent Cost, please provide free delivery if cost is less than 500 also it will be mostly helpful",0.5047619047619047
shampoo,I've too much dandruff and acne on my scalp ...and I'm using this from last 1 month but I didn get better result till now,0.49523809523809526
shampoo,This shampoo doesn remove dandruff,0.49523809523809526
shampoo,The Package is really good,0.49523809523809526
shampoo,I have been advised by the owner of the product that it will give me relief for 72 hours for the use and may use for a month and after that one week once is to used But in my experience it is useful for only six hours and after that itching is starting,0.4857142857142857
shampoo,Delivery time can improve,0.4857142857142857
shampoo,No benefit this item,0.44761904761904764
shampoo,It work good,0.44761904761904764
shampoo,Amazing results in just 4 wash Definitely recommended,0.41904761904761906
shampoo,Very nice product,0.41904761904761906
shampoo,Received next day,0.4
shampoo,Discount was less than other online sites,0.3333333333333333
shampoo,Its good product for hair and scalp,0.2761904761904762
shampoo,Worked really well for fungal infection,0.2571428571428571
shampoo,At first the Dandruff disappears - - but it reappear if the shampoo is not used for about a week. Hence I am not fully convinced about its efficacy in eradicating dandruff fully,0.2
shampoo,It doesn work,0.2
shampoo,It is a great product for dealing with dandruff,0.2
shampoo,Price is very high,0.2
shampoo,Good you can see the results with in second and third use,0.19047619047619047
shampoo,"Wash your head within 3 days for sometimes Or just someday in 2 days when you see more dandruff. its matter of few days you see your hair fall, but I didn see any of my hair falling Thankyou",0.18095238095238095
shampoo,Its really stops head itching n selfishness,0.13333333333333333
shampoo,I am using very offen last 6 yes its fantastic result on Dandruff free hair and smooth,0.01904761904761905
shampoo,Good shampoo.Helps to keep dandruff under control,0.01904761904761905
shampoo,After 2 to 3 usage it has cleared up my dandruff fully,0.01904761904761905
shampoo,its actually helpful indeed,0.01904761904761905
shampoo,Excellent service and cost also,0.01904761904761905
shampoo,It really helps to relieve dandruff and itching,0.009523809523809525
shampoo,Like product is as expected Dislike- no immediate relief or assured relief,0.009523809523809525
shampoo,It prevents scales formation on head skin and dandruff,0.009523809523809525
shampoo,I ly this shampoo..n also remove dandruff frm hairs,0.0
shampoo,Good for dandruff and scalpe problem,0.0
shampoo,Nice for anti dandruff,0.0
shampoo,The price is high.the shampoo is very good,0.0
shampoo,Like the timely delivery,0.0
shampoo,Delivery not in time,0.0
shampoo,Not supply in time,0.0
shampoo,I liked its on time delivery n price.,0.0
Supradyn,Could search the tablet faster,0.9726027397260274
Supradyn,I would like more if the tablet would be in capsule form and the covering would have been better than this,0.958904109589041
Supradyn,its an effective supplement I have been taking it since years,0.9315068493150684
Supradyn,As good as it is supposed to be,0.136986301369863
Supradyn,I take it more for its trace minerals and its extremely low price.it has proved to be a good vitamin supplement,0.0821917808219178
Supradyn,"its a good combination,but sometimes the tab turns to be sticky",0.0684931506849315
Supradyn,"Fair price, firm packing nice contents",0.0684931506849315
Supradyn,Great composition in minimal price,0.0547945205479452
Supradyn,1. painful review reminders .. pls stop it after you ask once .. 2. Update your stock properly dont make a person pay the money and then refund it after 2 days that is plain stealing peoples interest. A good web based service should not always have the right stock displayed and not miss lead people,0.0547945205479452
Supradyn,Supradyn Tablet being multi vitamin and multi mineral tablet is good for health and some improvement may be done by adding some traces of selenium and other essentials,0.0410958904109589
Supradyn,Very cost effective and adequate combination of essential vitamin and minerals,0.0410958904109589
Supradyn,Gives energy as it contains Vitamin B,0.0410958904109589
Supradyn,My wife takes supradyn tablet as vitamin supplement,0.0410958904109589
Supradyn,i didn purchase this Why are you adding incorrect medicines to my list. Is your data compromised,0.0410958904109589
Supradyn,No medicines available with other medicines but send as it was available,0.0410958904109589
Supradyn,GOOD DISCOUNT AND FAST SHIPPING,0.0410958904109589
Supradyn,Excellent and good service,0.0410958904109589
Supradyn,Tablets delivered in excellent condition. good quality product. Thanks,0.0410958904109589
Supradyn,its a value medicine and cheap in alternatives of vitamin tablet.,0.0273972602739726
Supradyn,It is good and improve my health,0.0273972602739726
Supradyn,It is a cheaper & good multi-vitamin.,0.0273972602739726
Supradyn,Its a good product with unfordable price,0.0273972602739726
Supradyn,I like it it helps in curing and reducing pain,0.0273972602739726
Supradyn,Value for money and effective,0.0273972602739726
Supradyn,Just ok as per price,0.0273972602739726
Supradyn,Tihis is dummy products,0.0273972602739726
Supradyn,Excellent Multi vitamin tablet,0.0273972602739726
Supradyn,"Tablet is good , its size is small easy to swallow After consuming the tablet I didn feel giddiness and was active throughout the day and no side effects .",0.0136986301369863
Supradyn,Felt a little lesser sweet as compared to pharmacy from the stores but was nice as price is also descent for,0.0136986301369863
Supradyn,I feel very energetic and relaxing,0.0136986301369863
Supradyn,A good value for money for vitamin supplement !,0.0136986301369863
Supradyn,Great multivitamin at low cost,0.0136986301369863
Supradyn,I have been using it since many years and found it workable.,0.0136986301369863
Supradyn,Cheap and Good multivitamin,0.0136986301369863
Supradyn,good results & value for money,0.0136986301369863
Supradyn,This is good supplement,0.0136986301369863
Supradyn,Very nice product and very effective,0.0136986301369863
Supradyn,I like its composition and very reasonable price,0.0136986301369863
Supradyn,Yet to use n test in bed,0.0136986301369863
Supradyn,"Meg 3, and some protein should be",0.0136986301369863
Supradyn,Not some allergy after taking this tablet.,0.0136986301369863
Supradyn,by ek kiss do na,0.0136986301369863
Supradyn,The colour of the urine after intake,0.0136986301369863
Supradyn,So-so product. Would not recommend to anyone,0.0136986301369863
Supradyn,Using it for last few years.Good product,0.0136986301369863
Supradyn,My favourite tablets,0.0136986301369863
Supradyn,I haven received free items displayed during my checkout,0.0136986301369863
Supradyn,Nice and very low price,0.0136986301369863
Supradyn,Couldn't get the results,0.0136986301369863
Supradyn,5 useful multivitamin,0.0136986301369863
Supradyn,Very reasonably priced. Product from a reputed parma co.,0.0136986301369863
Supradyn,Okay as a Daily it supplement,0.0136986301369863
Supradyn,doc said its best so bought it,0.0136986301369863
Supradyn,"Order 2-3 items and without my concern, you have canceled based on your comfortable Have you provided any coupon for the token of apologize Secondly who asked you to supply the balance and the entire order to be canceled instead of part is totally not acceptable",0.0136986301369863
Supradyn,STIPS DAMAGED DUE TO FRICTION AND NOT NEATLY PACKED,0.0136986301369863
Supradyn,Like the fast and damaged delivery of the strips,0.0136986301369863
Supradyn,No discount and shipping charges,0.0136986301369863
Supradyn,Service slow but good,0.0136986301369863
Supradyn,QUICK RESPONSE AND FAST DELIVERY,0.0136986301369863
Supradyn,Din't get PayPal cashback,0.0136986301369863
Supradyn,You canceled part item and my whole cash back got spoiled,0.0136986301369863
Supradyn,Few tablets were nacked,0.0136986301369863
Supradyn,It was very helpful to be active,0.0
Supradyn,It is good but have to take 2 if you lookout else go for a single tab with breakfast and drink at least 4 its water per day,0.0
Supradyn,Like.It is a good prophylactic vitamin product.,0.0
Supradyn,Good multi vitamin,0.0
Supradyn,We canst find some product,0.0
Supradyn,Nothing for dislike,0.0
Supradyn,BECAUSE I HAVE NOT PURCHASED,0.0
Supradyn,Best vitamin tablets,0.0
Supradyn,Trace Elements are essentials for every human being but most of the times neither those essential elements are not available in our drinking water( due to high filteration) nor in our daily foods .The combination is Excellent !,0.0
Supradyn,Total discount not given,0.0
Supradyn,Speedy delivery,0.0
Shelcal,Same as my previous reply,0.9947780678851175
Shelcal,As usual packing is in good condition and the delivery date is the same as informed,0.9947780678851175
Shelcal,Speedy supply,0.9947780678851175
Shelcal,Good,0.9921671018276762
Shelcal,Not good service,0.9921671018276762
Shelcal,Quick delivery,0.9921671018276762
Shelcal,"its effectable,after 40 every women should be use",0.9895561357702349
Shelcal,The delivery experience was very good and quick,0.9869451697127938
Shelcal,Good package,0.9843342036553525
Shelcal,Timely delivery with less price,0.9843342036553525
Shelcal,its good tablet for calcium intake,0.97911227154047
Shelcal,It works !,0.97911227154047
Shelcal,Product is good for me,0.9738903394255874
Shelcal,doctor prescription,0.9738903394255874
Shelcal,Feeling better,0.9712793733681462
Shelcal,like it,0.9712793733681462
Shelcal,Delivery charge why so,0.9712793733681462
Shelcal,Fast delivery,0.9660574412532638
Shelcal,I like the home delivery service is very good,0.9660574412532638
Shelcal,Nothing special,0.9608355091383812
Shelcal,Excellent Calcium supplement,0.95822454308094
Shelcal,Delivery timing,0.95822454308094
Shelcal,it was good,0.9556135770234987
Shelcal,Very effective tablet for artho problem,0.9556135770234987
Shelcal,Excellent,0.9556135770234987
Shelcal,doctors advice,0.9530026109660574
Shelcal,Good for bines,0.9503916449086162
Shelcal,Haddi lohe ke khambe i tarah majus hogai meri shelcal-500 ha kar. Itni mazbut i ab train bhi mere par sai nikal jaye to bhe mer haddi nasi tutegi. Makar igni achuki hai part 1 ungli par utah santa he,0.9503916449086162
Shelcal,To check its effectiveness yet,0.9477806788511749
Shelcal,Speedy Delivery,0.9477806788511749
Shelcal,as per the order,0.9451697127937336
Shelcal,Regular medicine for my parents Received in time,0.9451697127937336
Shelcal,Cheap but good,0.9425587467362925
Shelcal,Like,0.9425587467362925
Shelcal,works as expected,0.9399477806788512
Shelcal,good medicine,0.9373368146214099
Shelcal,Punctuality price,0.9347258485639687
Shelcal,Thecal is the most recommended supplement for calcium,0.9321148825065274
Shelcal,always good substitute for calcium,0.9295039164490861
Shelcal,"The whole action from your end,",0.9295039164490861
Shelcal,Not as per desire,0.9268929503916449
Shelcal,Good,0.9268929503916449
Shelcal,I take it occasionally so my experience is so so.,0.9242819843342036
Shelcal,Why your not providing the whole box with the strips like how we brought from outside,0.9138381201044387
Shelcal,prompt delivery,0.9138381201044387
Shelcal,Best in calcium supplement,0.9086161879895561
Shelcal,Good calcium tablet,0.9086161879895561
Shelcal,i like it,0.9086161879895561
Shelcal,Bought as advised by the doctor,0.9060052219321149
Shelcal,Good supplement,0.9007832898172323
Shelcal,Quick service,0.8981723237597912
Shelcal,Value for money,0.8955613577023499
Shelcal,good vitamin tab,0.8929503916449086
Shelcal,effective tool to cope calcium deficiency,0.8929503916449086
Shelcal,IT IS HELPFUL TO MY BODY,0.8929503916449086
Shelcal,Pretty good,0.8903394255874674
Shelcal,Same n cheap,0.8903394255874674
Shelcal,No dislike for this med,0.8903394255874674
Shelcal,Nothing,0.8903394255874674
Shelcal,Rapid delivery..n good discount,0.8903394255874674
Shelcal,Good deals,0.8877284595300261
Shelcal,this is good for calcium,0.8825065274151436
Shelcal,Good for calcium deficiency,0.8825065274151436
Shelcal,Not as much as get benefited like alfa alfa of away,0.8798955613577023
Shelcal,Good product,0.8798955613577023
Shelcal,instant relive,0.8798955613577023
Shelcal,Very useful,0.8798955613577023
Shelcal,I like,0.8798955613577023
Shelcal,Fast delivery,0.8772845953002611
Shelcal,We needed more discount,0.8772845953002611
Shelcal,Satisfied..no complaints yet,0.8720626631853786
Shelcal,Mud for bones,0.8720626631853786
Shelcal,Good product,0.8694516971279374
Shelcal,All was good in perfect condition,0.8616187989556136
Shelcal,Very low performance,0.8590078328981723
Shelcal,a little overpriced,0.8590078328981723
Shelcal,Vitamin,0.8590078328981723
Shelcal,Good packing,0.8590078328981723
Shelcal,Doctor prescribed so no opinion.,0.856396866840731
Shelcal,Less discount,0.856396866840731
Shelcal,Best Calcium supplement,0.8537859007832899
Shelcal,Good for diabetes,0.8537859007832899
Shelcal,Good but costly compared to other varieties of b- complex tabs,0.8485639686684073
Shelcal,Good product,0.8485639686684073
Shelcal,Effective,0.8485639686684073
Shelcal,Always dependable,0.8485639686684073
Shelcal,delivered on time.with discount,0.8381201044386423
Shelcal,It is good,0.835509138381201
Shelcal,Great taste,0.835509138381201
Shelcal,Print delivery,0.835509138381201
Shelcal,Good job,0.8328981723237598
Shelcal,Delivery speed,0.8302872062663186
Shelcal,Easy way to get medicine at your door step...,0.825065274151436
Shelcal,Good service,0.825065274151436
Shelcal,I didn get on time,0.825065274151436
Shelcal,The product is genuine,0.8198433420365535
Shelcal,Timely Delivery,0.8198433420365535
Shelcal,perfect for calcium requirement,0.8172323759791122
Shelcal,"NOT NOW,MAY GIVE FEEDBACK AFTER SEEING EFFECTS.",0.8172323759791122
Shelcal,Speed of delivery and Discount,0.8172323759791122
Shelcal,"Good , it reduces deficiency of calcium",0.7989556135770235
Shelcal,No commitment and no fixed delivery schedule,0.7989556135770235
Shelcal,its a good tablet for women in late 30s and 40s for keeping up with their It D and Calcium intake,0.7963446475195822
Shelcal,So far no side effects noticed,0.7963446475195822
Shelcal,Cooperation and fast supply,0.7963446475195822
Shelcal,Very poor service and not print got my medicine after days ..lots of improvement required,0.7963446475195822
Shelcal,Cheaper and better,0.793733681462141
Shelcal,Very useful,0.793733681462141
Shelcal,They are good for older persons,0.7911227154046997
Shelcal,Results are not unto the mark,0.7911227154046997
Shelcal,Helps to keep my calcium levels unto date,0.7885117493472585
Shelcal,Discount rate very low other outside market,0.7885117493472585
Shelcal,For my wife as prescribed by the Doctor to take care of calcium deficiency,0.783289817232376
Shelcal,Excellent tablet,0.783289817232376
Shelcal,Its smartly packed,0.783289817232376
Shelcal,I am like it and also happy with the discount,0.783289817232376
Shelcal,Correct addressing of issue,0.7806788511749347
Shelcal,Very Poor Service,0.7806788511749347
Shelcal,It D with Calcium,0.7780678851174935
Shelcal,Good,0.7728459530026109
Shelcal,Normal supply,0.7728459530026109
Shelcal,Good,0.7702349869451697
Shelcal,its perfect for vitamin d3,0.7676240208877284
Shelcal,size of tablet,0.7676240208877284
Shelcal,I like Thecal - 500 Tablet and using it for quite a long time. It is very suitable for me.,0.7650130548302873
Shelcal,It MFD date and timely delivery,0.7650130548302873
Shelcal,All good,0.762402088772846
Shelcal,Better rates in the market,0.7597911227154047
Shelcal,please arrange immediately.Its very essential,0.7571801566579635
Shelcal,Rated good to treat calcium and vitamin deficiency,0.7519582245430809
Shelcal,Or prescribed it so using it,0.7519582245430809
Shelcal,I am using since long,0.7493472584856397
Shelcal,very good,0.7493472584856397
Shelcal,Good source of calcium,0.7441253263707572
Shelcal,Like,0.7441253263707572
Shelcal,Andorra exp.,0.7389033942558747
Shelcal,Really good tablet,0.7362924281984334
Shelcal,liked packing and delivery,0.7310704960835509
Shelcal,Advised by doctor,0.7258485639686684
Shelcal,Good,0.7258485639686684
Shelcal,Discount is very less,0.7258485639686684
Shelcal,Fast delivery with good packing,0.7232375979112271
Shelcal,product is ok.,0.7154046997389034
Shelcal,Satisfactory,0.7154046997389034
Shelcal,Very good item,0.7101827676240209
Shelcal,Good packing,0.7101827676240209
Shelcal,Delivery group was there However product n packing were good,0.7101827676240209
Shelcal,quick delivery and discount,0.7101827676240209
Shelcal,Like ...... good,0.7075718015665796
Shelcal,Quality is not good,0.7075718015665796
Shelcal,Good medicine for calcium,0.7049608355091384
Shelcal,Good calcium supplement,0.7049608355091384
Shelcal,Discount is not competable,0.7023498694516971
Shelcal,Delivery speed,0.7023498694516971
Shelcal,Cannot find any efdect. May be effective may be not,0.6997389033942559
Shelcal,Good product,0.6997389033942559
Shelcal,Dislike because not effective,0.6971279373368147
Shelcal,Good as calcium supplement,0.6971279373368147
Shelcal,Good packing prompt delivery,0.6971279373368147
Shelcal,I like it.,0.6945169712793734
Shelcal,All good,0.6945169712793734
Shelcal,Right choice,0.6945169712793734
Shelcal,Delivery so lately...,0.6945169712793734
Shelcal,We are getting 15% discount for this medicine from local medical Shop,0.6919060052219321
Shelcal,Nothing special This is a medication my wife is regularly taking,0.6892950391644909
Shelcal,The new print on the backside,0.6892950391644909
Shelcal,Getting in lesser price outside,0.6866840731070496
Shelcal,Good enuf,0.6866840731070496
Shelcal,big size,0.6866840731070496
Shelcal,I am taking it in good faith expecting it to be genuine No question to like or dislike it.,0.6840731070496083
Shelcal,Improve the bone strength,0.6814621409921671
Shelcal,great buy it now,0.6814621409921671
Shelcal,Could be better,0.6788511749347258
Shelcal,Nice,0.6788511749347258
Shelcal,Good quality,0.6762402088772846
Shelcal,Sweet outer coating is easy to swallow,0.6684073107049608
Shelcal,A known medicine for calcium deficiency Very useful,0.6684073107049608
Shelcal,Muscle ache improved,0.6684073107049608
Shelcal,IT IS FOR MY WIFE AS PRESCRIBED BY THE DOCTOR. NOTHING TO SAY ABOUT IT,0.6684073107049608
Shelcal,Doctor happy patient happy,0.6684073107049608
Shelcal,Just started taking this tablet 1 month back canst say anything right now,0.6684073107049608
Shelcal,very expensive will never buy now first price is more secondly other chemists r offering much much more than u. i have been cheated,0.6657963446475196
Shelcal,Good,0.6657963446475196
Shelcal,Liked it,0.6657963446475196
Shelcal,Food all,0.6657963446475196
Shelcal,Good Packing. Genuine Medicines,0.6657963446475196
Shelcal,Less Discount,0.6657963446475196
Shelcal,Nothing Variable,0.6631853785900783
Shelcal,Dislike,0.6631853785900783
Shelcal,No response,0.6527415143603134
Shelcal,Quick delivery of medicine is very much appreciated,0.6501305483028721
Shelcal,Good one my daughter,0.6475195822454308
Shelcal,Good,0.6475195822454308
Shelcal,Effectiveness,0.6475195822454308
Shelcal,Prompt delivery,0.6475195822454308
Shelcal,Have to take them whether like or not,0.6422976501305483
Shelcal,Disount packing,0.6422976501305483
Shelcal,Using it more than 3 years,0.639686684073107
Shelcal,Your rate of Becasul and shelcal500 touch high,0.639686684073107
Shelcal,It works as claimed,0.6344647519582245
